{"outer_envelope_schema":"schemas/story-construction/precontent-acceptance-regression-closeout-envelope-v1.schema.json","payload":{"change_set_id":"CS-SCG-PRECONTENT-M3-B003-P0-ACCEPTANCE-REGRESSION-R4-001","finding_id":"B003-BLK-002","fixed_predecessor":{"commit":"2d7f78f5b24623729cb64a798b59d6f469e6de2b","final_receipt_r3_file_sha256":"1598688eab7beb93aa6497dc01ba71e0c20df07aa4a3976ebb511ecf31d02443","final_receipt_r3_payload_sha256":"d793b0aa4d84acfbc94fe41f4980e41a282e9ef5dc9110344f9053f9999aadc7","framework_manifest_r3_file_sha256":"836fbaf57137d31429e5f54aa52035edc10c2768480c73ab9e55631cbcc2cae4","framework_manifest_r3_merkle_root":"48d8a22fed2142228d2ca5233ff894f0e3cb182fa1899ce73af8366d45078474","framework_manifest_r3_record_count":81,"framework_manifest_r3_semantic_record_set_sha256":"3f6071050644d5fe4cbfc39fc689383f55c9d874f7af87d9aecdf639ea4bd0ab","logical_proof_tag_ref":"refs/tags/scg-precontent-m3-b002-authoritative-effect-repair-accepted","parent":"d80aae8d1dfede85d91ff0367f4c6a18d62bb2a7","proof_tag_object":"421e36ce08076d5eb9ef43049c8bdf9edafa16d3","tree":"f0fdf751d7532097926d36f3ac723f563e82cfd3"},"fixed_preservation":{"canon_sha256":"d7ceea75615b57970f3b9712b73ed4c9f65a9c4406c877e9013470cb53a6141a","m2_sha256":"74da7cc866e0b3b1f3580d86df18c8c6d9724ff6131e5d35c155fc33a2f71c17","provider_zero_call_sha256":"e6536a180aeb21b20ca9b65594610e65c50d72bf388b513533bed799366214f5","q001_q130_sha256":"01fdebbd338a8abdbc0226d0290b1bc2b02366cb615a22182f0df0a5f75fa7b2","runtime_sha256":"29ea1e0278e37d183d4c0ff396437088b4873c58c5e9a9c857093f6c552a6314"},"framework_manifests":{"r3":{"file_sha256":"836fbaf57137d31429e5f54aa52035edc10c2768480c73ab9e55631cbcc2cae4","merkle_root":"48d8a22fed2142228d2ca5233ff894f0e3cb182fa1899ce73af8366d45078474","path":"governance/story-construction/precontent/manifests/framework-manifest.r3.json","record_count":81,"semantic_path_content_record_set_hash":"3f6071050644d5fe4cbfc39fc689383f55c9d874f7af87d9aecdf639ea4bd0ab"},"r4":{"file_sha256":"786efd71b42728e7f87cc562b2c5e9a9377dbf524614fb31bb168fea5157a592","merkle_root":"06444498a11d968b050145e1813042ba08bb8336f96bba45ae8e1351265dfead","path":"governance/story-construction/precontent/manifests/framework-manifest.r4.json","record_count":88,"semantic_path_content_record_set_hash":"ec9a4d69b511247a407ce3cb3d32851b0c80d95b9bca01013f9c9bfab9b17e4d"}},"machine_batch_id":"M3-B003","machine_milestone":"M3","machine_phase":"B003-P0-B","manifest_model":"MODEL_R4_ADDITIVE_ACCEPTANCE_REGRESSION","provider_request_counts":{"deepseek":0,"grok":0,"opencode":0,"story_m0":0},"r4_path_allowlist":{"path_count":15,"sha256":"98b6869eaeb0013c7abe1fb66625282c55321e7eafdf277228f28bbfdb6d2859"},"r4_transition":{"changed_old_count":6,"changed_old_leaf_transition_hash":"7a85a4900c1e9f2e4e87896913b5feebcc945cf968be50d78de3fae276d6395e","new_leaf_set_hash":"5e2cf0b4f21354e959d7b8f1c07c78c062fa8761e88ef4e547a8ac26e71ed8e9","new_record_count":7,"old_record_count":81,"r3_leaf_set_hash":"3f6071050644d5fe4cbfc39fc689383f55c9d874f7af87d9aecdf639ea4bd0ab","r4_leaf_set_hash":"ec9a4d69b511247a407ce3cb3d32851b0c80d95b9bca01013f9c9bfab9b17e4d","total_record_count":88,"unchanged_old_count":75,"unchanged_old_leaf_set_hash":"9f76ce8ad74d02ed792e78193bab9d1669299e814d52b32c72960d67c2747cad"},"receipt_id":"SCG-PRECONTENT-READINESS-R4-FINAL-001","receipt_status":"PENDING_OWNER_EXACT_HASH_APPROVAL_M3_B003_P0_B_R4","repair_task_id":"SCG-PRECONTENT-M3-B003-P0-B-R4-ACCEPTANCE-REGRESSION-REPAIR-IMPLEMENT-001","schema_sets":{"combined_schema_count":32,"combined_schema_set_hash":"77fc9d1a657b3dbe9e08032e561ff20e1014972d0567b01f3b4e19efb4541d44","original_schema_count":20,"original_schema_set_hash":"77c8d831c2fd4b79edc597215135ca111fd76b1e00b9d126fda5a4d1a7fcdc50","predecessor_schema_count":28,"predecessor_schema_set_hash":"c26c1a568f3f74346bbca6f7f56c4e359406d04aeadc4ee9259e8e91d5ef4ef6","preserved_activation_v1_schema_count":5,"preserved_activation_v1_schema_set_hash":"86d86a286fd1bbd3810720b943d61c1e00c3a63c9e6aed714f6e40d072b90b7f","r3_repair_schema_count":3,"r3_repair_schema_set_hash":"4823a2a02676d001e8840961747dc3f36e8535ea148271930ebbee99bdb61592","r4_schema_count":4,"r4_schema_set_hash":"2a5a0d0d6133836130c9129324c172d3354c53577744bcc360365676ea7d5577"},"schema_version":"rules-residue.story-construction.precontent-final-receipt/4.0.0","successor_state":{"ancestry_alone_sufficient":false,"approval_status":"PENDING_OWNER_EXACT_HASH_APPROVAL_M3_B003_P0_B_R4","authoritative_successor_effective":false,"independent_accept_status":"NOT_RUN","lifecycle_stage":"CANDIDATE"}},"payload_hash":"f2458b4543fa930dfc9853a968d06d1e5cf689f36ca6dec1970ec6cd64b1e878","receipt_kind":"TRACKED_INNER_ACCEPTANCE_REGRESSION_R4_RECEIPT","schema_version":"rules-residue.story-construction.precontent-final-receipt/4.0.0"}
